{
  "answers": {
    "q1": "A",
    "q2": "B",
    "q3": "A",
    "q4": "B",
    "q5": "B",
    "q6": [
      "E1",
      "E2"
    ]
  },
  "claim_boundary": "Conclusion is limited to the supplied evidence and named operating conditions.",
  "confidence": 0.95,
  "schema_version": "2.0",
  "task_id": "v06-diagnosis-06-diagnosis-capstone"
}
