{
  "answers": {
    "q1": "B",
    "q2": "C",
    "q3": "B",
    "q4": "D",
    "q5": "B",
    "q6": [
      "E1",
      "E3"
    ]
  },
  "claim_boundary": "Conclusion is limited to the supplied evidence and named operating conditions.",
  "confidence": 0.95,
  "schema_version": "2.0",
  "task_id": "v06-migration-05-leakage-startup"
}
