{
  "answers": {
    "q1": "C",
    "q2": "C",
    "q3": "A",
    "q4": "A",
    "q5": "A",
    "q6": [
      "E4",
      "E2"
    ]
  },
  "claim_boundary": "Conclusion is limited to the supplied evidence and named operating conditions.",
  "confidence": 0.95,
  "schema_version": "2.0",
  "task_id": "v06-architecture-choice-m01-alias-invariance"
}
