{
  "answers": {
    "q1": "D",
    "q2": "D",
    "q3": "B",
    "q4": "A",
    "q5": "A",
    "q6": [
      "E1",
      "E2"
    ]
  },
  "claim_boundary": "Conclusion is limited to the supplied evidence and named operating conditions.",
  "confidence": 0.95,
  "schema_version": "2.0",
  "task_id": "v06-structure-05-startup-loop"
}
