{
  "answers": {
    "q1": "B",
    "q2": "A",
    "q3": "A",
    "q4": "A",
    "q5": "C",
    "q6": [
      "E1",
      "E3"
    ]
  },
  "claim_boundary": "Conclusion is limited to the supplied evidence and named operating conditions.",
  "confidence": 0.95,
  "schema_version": "2.0",
  "task_id": "v06-system-impact-02-load-spectrum"
}
