{
  "answers": {
    "q1": "D",
    "q2": "C",
    "q3": "B",
    "q4": "D",
    "q5": [
      "C",
      "A",
      "B",
      "D"
    ],
    "q6": [
      "E1",
      "E3"
    ]
  },
  "claim_boundary": "Conclusion is limited to the supplied evidence and named operating conditions.",
  "confidence": 0.95,
  "schema_version": "2.0",
  "task_id": "v06-architecture-choice-04-feedforward"
}
