{
  "answers": {
    "q1": "B",
    "q2": "C",
    "q3": "B",
    "q4": "A",
    "q5": "C",
    "q6": [
      "E2",
      "E4"
    ]
  },
  "claim_boundary": "Conclusion is limited to the supplied evidence and named operating conditions.",
  "confidence": 0.95,
  "schema_version": "2.0",
  "task_id": "v06-diagnosis-04-iq-excess"
}
